<?xml version="1.0" encoding="UTF-8"?>
<ns:pages xmlns:ns="http://www.sap.com/dcm/uiPage"
	xmlns:xsi="http://www.w3.org/2001/XMLSchema-instance"
	xsi:schemaLocation="http://www.sap.com/dcm/uiPage uiPage.xsd ">
	<ns:page id="com.sap.dcm.ilm" uiText="lbl.ilm.headPage">
		<ns:page id="com.sap.dcm.ilm.CustomerData" uiText="lbl.ilm.custData.headPage"/>
		<ns:allowedRole id="SAP_DCM_ILM_READ"/>
		<ns:allowedRole id="SAP_DCM_ILM_DELETE"/>
	</ns:page>
	<ns:page id="com.sap.dcm.appMgmt.AppMgmt" uiText="lbl.appMgmt.headPage">
		<ns:page id="com.sap.dcm.appMgmt.UserMgmt" uiText="lbl.appMgmt.userMgmt.headPage" />
		<ns:allowedRole id="SAP_DCM_USER_ADM"/>
	</ns:page>
</ns:pages>
